{
  "cycle": 77,
  "mode": "POST_CYCLE_PM_REVIEW",
  "result": "ADVISORY_ONLY",
  "blocks_dispatch": false,
  "errors": [],
  "warnings": [
    "Claude PM review is advisory-only: Claude review timed out after 10 minutes  Next dispatch BLOCKED until official review completes."
  ],
  "facts": {
    "cycle": 77,
    "mode": "POST_CYCLE_PM_REVIEW",
    "collected_at": "2026-06-13T07:57:34.890745+00:00",
    "head_sha": "41bac8c5f9e06854970a7f6df8df0ac6a66cc2eb",
    "develop_sha": "e0c9753b023c3c96b5214d73dd4d441816c969d8",
    "pr_number": 1,
    "pr_merged": true,
    "merge_sha": "7e3be60ac39d84fc9be76170035cbaeb4ade65c2",
    "ci_passed": false,
    "codecov_project": "UNKNOWN",
    "codecov_patch": "UNKNOWN",
    "codex_threads_resolved": false,
    "local_ruff": false,
    "local_mypy": false,
    "local_pytest": false,
    "local_coverage_pct": 0.0,
    "baseline_db_mtime_unchanged": true,
    "scrapfly_enabled_false": true,
    "cycle_control_done": false,
    "next_cycle_control_created": false,
    "agent_reports_present": {
      "A": true,
      "B": true,
      "E": true,
      "C": true,
      "F": true,
      "D": true
    },
    "score1_internal_pct": 0.0,
    "score2_e2e_pct": 0.0,
    "tierd2_stages": {}
  },
  "evaluated_at": "2026-06-13T08:07:38.137070+00:00"
}