{
  "cycle": 77,
  "mode": "POST_CYCLE_PM_REVIEW",
  "result": "FAIL",
  "blocks_dispatch": true,
  "errors": [
    "PR not merged \u2014 cannot run POST_CYCLE_PM_REVIEW"
  ],
  "warnings": [],
  "facts": {
    "cycle": 77,
    "mode": "POST_CYCLE_PM_REVIEW",
    "collected_at": "2026-06-13T07:30:26.078052+00:00",
    "head_sha": "41bac8c5f9e06854970a7f6df8df0ac6a66cc2eb",
    "develop_sha": "87b5f924ee1b8ec06dd8094da8e4e05dbc905414",
    "pr_number": null,
    "pr_merged": false,
    "merge_sha": "",
    "ci_passed": false,
    "codecov_project": "UNKNOWN",
    "codecov_patch": "UNKNOWN",
    "codex_threads_resolved": false,
    "local_ruff": false,
    "local_mypy": false,
    "local_pytest": false,
    "local_coverage_pct": 0.0,
    "baseline_db_mtime_unchanged": true,
    "scrapfly_enabled_false": true,
    "cycle_control_done": false,
    "next_cycle_control_created": false,
    "agent_reports_present": {
      "A": true,
      "B": true,
      "E": true,
      "C": true,
      "F": true,
      "D": true
    },
    "score1_internal_pct": 0.0,
    "score2_e2e_pct": 0.0,
    "tierd2_stages": {}
  },
  "evaluated_at": "2026-06-13T07:30:28.025399+00:00"
}