{
  "cycle": 77,
  "mode": "POST_CYCLE_PM_REVIEW",
  "result": "FAIL",
  "blocks_dispatch": true,
  "errors": [
    "Missing agent reports (official review requires all 6): ['A', 'B', 'E', 'C', 'F', 'D']",
    "cycle037_live.db mtime changed \u2014 baseline tampered"
  ],
  "warnings": [],
  "facts": {
    "cycle": 77,
    "mode": "POST_CYCLE_PM_REVIEW",
    "collected_at": "2026-06-13T05:48:22.903364+00:00",
    "head_sha": "41bac8c5f9e06854970a7f6df8df0ac6a66cc2eb",
    "develop_sha": "87b5f924ee1b8ec06dd8094da8e4e05dbc905414",
    "pr_number": 88,
    "pr_merged": true,
    "merge_sha": "e0c9753b023c3c96b5214d73dd4d441816c969d8",
    "ci_passed": false,
    "codecov_project": "UNKNOWN",
    "codecov_patch": "SUCCESS",
    "codex_threads_resolved": false,
    "local_ruff": false,
    "local_mypy": false,
    "local_pytest": false,
    "local_coverage_pct": 0.0,
    "baseline_db_mtime_unchanged": false,
    "scrapfly_enabled_false": true,
    "cycle_control_done": false,
    "next_cycle_control_created": false,
    "agent_reports_present": {
      "A": false,
      "B": false,
      "E": false,
      "C": false,
      "F": false,
      "D": false
    },
    "score1_internal_pct": 0.0,
    "score2_e2e_pct": 0.0,
    "tierd2_stages": {}
  },
  "evaluated_at": "2026-06-13T05:48:25.618932+00:00"
}